{
  "name": "cfa-frm-formula-sheets",
  "version": "1.0.0",
  "source_checked": "2026-10-12",
  "license": "CC-BY-4.0",
  "entries": [
    {
      "id": "cfa1-001",
      "exam": "CFA Level I",
      "topic": "Quantitative Methods",
      "name": "Future value (discrete compounding)",
      "latex": "FV = PV\\,(1+r)^{N}",
      "variables": "PV present value; r periodic rate; N number of periods",
      "when_used": "Growing a single cash flow forward",
      "topic_source_url": "https://www.cfainstitute.org/programs/cfa-program/candidate-resources/level-i-exam",
      "source_checked": "2026-10-12",
      "uniprep2go_url": "https://uniprep2go.study/decks/cfa-level-1-formula-reference-2026"
    },
    {
      "id": "cfa1-002",
      "exam": "CFA Level I",
      "topic": "Quantitative Methods",
      "name": "Present value of an ordinary annuity",
      "latex": "PV = A\\,\\frac{1-(1+r)^{-N}}{r}",
      "variables": "A level payment at end of each period; r periodic rate; N periods",
      "when_used": "Loan payments, bond coupons, retirement income",
      "topic_source_url": "https://www.cfainstitute.org/programs/cfa-program/candidate-resources/level-i-exam",
      "source_checked": "2026-10-12",
      "uniprep2go_url": "https://uniprep2go.study/decks/cfa-level-1-formula-reference-2026"
    },
    {
      "id": "cfa1-003",
      "exam": "CFA Level I",
      "topic": "Quantitative Methods",
      "name": "Present value of a perpetuity",
      "latex": "PV = \\frac{A}{r}",
      "variables": "A constant payment per period; r discount rate",
      "when_used": "Preferred stock, consols",
      "topic_source_url": "https://www.cfainstitute.org/programs/cfa-program/candidate-resources/level-i-exam",
      "source_checked": "2026-10-12",
      "uniprep2go_url": "https://uniprep2go.study/decks/cfa-level-1-formula-reference-2026"
    },
    {
      "id": "cfa1-004",
      "exam": "CFA Level I",
      "topic": "Quantitative Methods",
      "name": "Effective annual rate",
      "latex": "EAR = \\left(1+\\frac{r_s}{m}\\right)^{m}-1",
      "variables": "r_s stated annual rate; m compounding periods per year",
      "when_used": "Comparing rates with different compounding frequencies",
      "topic_source_url": "https://www.cfainstitute.org/programs/cfa-program/candidate-resources/level-i-exam",
      "source_checked": "2026-10-12",
      "uniprep2go_url": "https://uniprep2go.study/decks/cfa-level-1-formula-reference-2026"
    },
    {
      "id": "cfa1-005",
      "exam": "CFA Level I",
      "topic": "Quantitative Methods",
      "name": "Continuous compounding",
      "latex": "FV = PV\\,e^{r_s N}",
      "variables": "r_s stated annual rate; N years",
      "when_used": "Continuously compounded returns and growth",
      "topic_source_url": "https://www.cfainstitute.org/programs/cfa-program/candidate-resources/level-i-exam",
      "source_checked": "2026-10-12",
      "uniprep2go_url": "https://uniprep2go.study/decks/cfa-level-1-formula-reference-2026"
    },
    {
      "id": "cfa1-006",
      "exam": "CFA Level I",
      "topic": "Quantitative Methods",
      "name": "Holding period return",
      "latex": "HPR = \\frac{P_1 - P_0 + D_1}{P_0}",
      "variables": "P_0 beginning price; P_1 ending price; D_1 income received",
      "when_used": "Single-period return including income",
      "topic_source_url": "https://www.cfainstitute.org/programs/cfa-program/candidate-resources/level-i-exam",
      "source_checked": "2026-10-12",
      "uniprep2go_url": "https://uniprep2go.study/decks/cfa-level-1-formula-reference-2026"
    },
    {
      "id": "cfa1-007",
      "exam": "CFA Level I",
      "topic": "Quantitative Methods",
      "name": "Geometric mean return",
      "latex": "\\bar R_G = \\left[\\prod_{t=1}^{T}(1+R_t)\\right]^{1/T}-1",
      "variables": "R_t return in period t; T number of periods",
      "when_used": "Compound average growth rate over multiple periods",
      "topic_source_url": "https://www.cfainstitute.org/programs/cfa-program/candidate-resources/level-i-exam",
      "source_checked": "2026-10-12",
      "uniprep2go_url": "https://uniprep2go.study/decks/cfa-level-1-formula-reference-2026"
    },
    {
      "id": "cfa1-008",
      "exam": "CFA Level I",
      "topic": "Quantitative Methods",
      "name": "Sample variance",
      "latex": "s^2 = \\frac{\\sum_{i=1}^{n}(X_i-\\bar X)^2}{n-1}",
      "variables": "X_i observations; \\bar X sample mean; n sample size",
      "when_used": "Dispersion of a sample",
      "topic_source_url": "https://www.cfainstitute.org/programs/cfa-program/candidate-resources/level-i-exam",
      "source_checked": "2026-10-12",
      "uniprep2go_url": "https://uniprep2go.study/decks/cfa-level-1-formula-reference-2026"
    },
    {
      "id": "cfa1-009",
      "exam": "CFA Level I",
      "topic": "Quantitative Methods",
      "name": "Coefficient of variation",
      "latex": "CV = \\frac{s}{\\bar X}",
      "variables": "s sample standard deviation; \\bar X sample mean",
      "when_used": "Risk per unit of return",
      "topic_source_url": "https://www.cfainstitute.org/programs/cfa-program/candidate-resources/level-i-exam",
      "source_checked": "2026-10-12",
      "uniprep2go_url": "https://uniprep2go.study/decks/cfa-level-1-formula-reference-2026"
    },
    {
      "id": "cfa1-010",
      "exam": "CFA Level I",
      "topic": "Quantitative Methods",
      "name": "Sharpe ratio",
      "latex": "S_p = \\frac{\\bar R_p - R_f}{\\sigma_p}",
      "variables": "\\bar R_p portfolio mean return; R_f risk-free rate; \\sigma_p portfolio standard deviation",
      "when_used": "Risk-adjusted performance",
      "topic_source_url": "https://www.cfainstitute.org/programs/cfa-program/candidate-resources/level-i-exam",
      "source_checked": "2026-10-12",
      "uniprep2go_url": "https://uniprep2go.study/decks/cfa-level-1-formula-reference-2026"
    },
    {
      "id": "cfa1-011",
      "exam": "CFA Level I",
      "topic": "Quantitative Methods",
      "name": "Sample correlation",
      "latex": "r_{XY} = \\frac{s_{XY}}{s_X\\, s_Y}",
      "variables": "s_{XY} sample covariance; s_X, s_Y sample standard deviations",
      "when_used": "Strength of linear relationship",
      "topic_source_url": "https://www.cfainstitute.org/programs/cfa-program/candidate-resources/level-i-exam",
      "source_checked": "2026-10-12",
      "uniprep2go_url": "https://uniprep2go.study/decks/cfa-level-1-formula-reference-2026"
    },
    {
      "id": "cfa1-012",
      "exam": "CFA Level I",
      "topic": "Quantitative Methods",
      "name": "Bayes' formula",
      "latex": "P(A\\mid B) = \\frac{P(B\\mid A)\\,P(A)}{P(B)}",
      "variables": "P(A) prior; P(B|A) likelihood; P(B) unconditional probability",
      "when_used": "Updating probabilities with new information",
      "topic_source_url": "https://www.cfainstitute.org/programs/cfa-program/candidate-resources/level-i-exam",
      "source_checked": "2026-10-12",
      "uniprep2go_url": "https://uniprep2go.study/decks/cfa-level-1-formula-reference-2026"
    },
    {
      "id": "cfa1-013",
      "exam": "CFA Level I",
      "topic": "Quantitative Methods",
      "name": "z-statistic / standardization",
      "latex": "z = \\frac{X-\\mu}{\\sigma}",
      "variables": "X value; \\mu mean; \\sigma standard deviation",
      "when_used": "Standard normal probabilities",
      "topic_source_url": "https://www.cfainstitute.org/programs/cfa-program/candidate-resources/level-i-exam",
      "source_checked": "2026-10-12",
      "uniprep2go_url": "https://uniprep2go.study/decks/cfa-level-1-formula-reference-2026"
    },
    {
      "id": "cfa1-014",
      "exam": "CFA Level I",
      "topic": "Quantitative Methods",
      "name": "t-statistic for a mean",
      "latex": "t = \\frac{\\bar X-\\mu_0}{s/\\sqrt{n}}",
      "variables": "\\bar X sample mean; \\mu_0 hypothesized mean; s sample std dev; n sample size (df = n-1)",
      "when_used": "Hypothesis test of a population mean",
      "topic_source_url": "https://www.cfainstitute.org/programs/cfa-program/candidate-resources/level-i-exam",
      "source_checked": "2026-10-12",
      "uniprep2go_url": "https://uniprep2go.study/decks/cfa-level-1-formula-reference-2026"
    },
    {
      "id": "cfa1-015",
      "exam": "CFA Level I",
      "topic": "Quantitative Methods",
      "name": "Simple linear regression slope",
      "latex": "\\hat b_1 = \\frac{\\operatorname{Cov}(X,Y)}{\\operatorname{Var}(X)}",
      "variables": "Cov(X,Y) covariance; Var(X) variance of the independent variable",
      "when_used": "Estimating the slope coefficient",
      "topic_source_url": "https://www.cfainstitute.org/programs/cfa-program/candidate-resources/level-i-exam",
      "source_checked": "2026-10-12",
      "uniprep2go_url": "https://uniprep2go.study/decks/cfa-level-1-formula-reference-2026"
    },
    {
      "id": "cfa1-016",
      "exam": "CFA Level I",
      "topic": "Quantitative Methods",
      "name": "Coefficient of determination (simple regression)",
      "latex": "R^2 = \\frac{SSR}{SST} = 1-\\frac{SSE}{SST}",
      "variables": "SSR regression sum of squares; SSE sum of squared errors; SST total sum of squares",
      "when_used": "Share of variation explained",
      "topic_source_url": "https://www.cfainstitute.org/programs/cfa-program/candidate-resources/level-i-exam",
      "source_checked": "2026-10-12",
      "uniprep2go_url": "https://uniprep2go.study/decks/cfa-level-1-formula-reference-2026"
    },
    {
      "id": "cfa1-017",
      "exam": "CFA Level I",
      "topic": "Economics",
      "name": "Price elasticity of demand",
      "latex": "E_P = \\frac{\\%\\Delta Q_d}{\\%\\Delta P}",
      "variables": "Q_d quantity demanded; P price",
      "when_used": "Responsiveness of demand to price",
      "topic_source_url": "https://www.cfainstitute.org/programs/cfa-program/candidate-resources/level-i-exam",
      "source_checked": "2026-10-12",